{"build_channel":"community","capabilities":[{"allowed_rule_types":["presence_duration","absence_duration"],"capability_id":"visual_target","display_name":"参考图片识别","recipe_ids":["neural_reference_target_v1","object_detection_general_v1"],"target_modes":["reference_images","object_class"]},{"allowed_rule_types":["reading_threshold"],"capability_id":"structured_reading","display_name":"自动数字读数","recipe_ids":["reading_pipeline_general_v1"],"target_modes":["none"]}],"catalog_id":"be-your-eye-website-v1","catalog_version":"2026.09.21.1","issued_at":"2026-09-21T06:31:29Z","operational_capabilities":[{"applicable_scenarios":["同一固定场景中与3至20张参考图片外观相近的显著目标"],"capability_id":"visual_target","capability_key":"reference_object_matching","device_profile_ids":["android_arm64_8gb_launch_v1"],"display_name":"参考图片匹配","human_review":{"evidence_refs":["model-tools/v3/reviews/reference-publisher-license-2026-09-18.md"],"license_conclusion":"approved-for-community","reviewed_at":"2026-09-18T12:49:39Z"},"inapplicable_scenarios":["开放词汇识别","多目标跟踪","专业缺陷诊断"],"input_requirements":["3至20张去重参考图片","完整目标清晰可见","纵向后摄固定机位"],"intent_patterns":["visual.reference.*"],"model_card":{"model_home_url":"https://ai.google.dev/edge/mediapipe/solutions/vision/image_embedder/android","model_kind":"general","model_name":"MediaPipe MobileNetV3 Large Image Embedder","provider_id":"google","provider_name":"Google"},"package_ids":["similarity_mediapipe_mobilenet_v3_large_v1"],"professional_domain":"固定机位参考外观匹配","recipe_id":"neural_reference_target_v1","status":"community"},{"applicable_scenarios":["签名 COCO 有限类别中的常见物体，固定机位本机运行"],"capability_id":"visual_target","capability_key":"common_objects_tensorflow_efficientdet_lite2","device_profile_ids":["android_arm64_8gb_launch_v1"],"display_name":"常见物体检测","human_review":{"evidence_refs":["model-tools/v3/object-detection/efficientdet-lite2/LICENSE-REVIEW.md"],"license_conclusion":"approved-for-community","reviewed_at":"2026-09-18T12:49:39Z"},"inapplicable_scenarios":["任意描述检测","多目标跟踪","专业安全或缺陷判断"],"input_requirements":["签名类别名或别名精确选择","固定机位"],"intent_patterns":["object.common.*"],"model_card":{"model_home_url":"https://www.kaggle.com/models/tensorflow/efficientdet/tfLite/lite2-detection-metadata/1","model_kind":"general","model_name":"EfficientDet-Lite2 COCO","provider_id":"tensorflow","provider_name":"TensorFlow"},"package_ids":["efficientdet_lite2_object_v1"],"professional_domain":"有限类别目标检测","recipe_id":"object_detection_general_v1","status":"community","target_ids":["person","bicycle","car","motorcycle","airplane","bus","train","truck","boat","traffic_light","fire_hydrant","stop_sign","parking_meter","bench","bird","cat","dog","horse","sheep","cow","elephant","bear","zebra","giraffe","backpack","umbrella","handbag","tie","suitcase","frisbee","skis","snowboard","sports_ball","kite","baseball_bat","baseball_glove","skateboard","surfboard","tennis_racket","bottle","wine_glass","cup","fork","knife","spoon","bowl","banana","apple","sandwich","orange","broccoli","carrot","hot_dog","pizza","donut","cake","chair","couch","potted_plant","bed","dining_table","toilet","tv","laptop","mouse","remote","keyboard","cell_phone","microwave","oven","toaster","sink","refrigerator","book","clock","vase","scissors","teddy_bear","hair_drier","toothbrush"]},{"applicable_scenarios":["纵向可见画面中的单行结构化读数，包括时间、金额、百分比、科学计数和短单位"],"capability_id":"structured_reading","capability_key":"numeric_display_reading","device_profile_ids":["android_arm64_8gb_launch_v1"],"display_name":"自动数字读数","human_review":{"evidence_refs":["model-tools/v3/reviews/ppocrv6-tiny-det-medium-rec-composite-0.1.0-internal.13-2026-08-24.md"],"license_conclusion":"approved-for-community","reviewed_at":"2026-09-18T12:49:39Z"},"inapplicable_scenarios":["模拟表盘","画面中没有完整读数","机位或目标布局持续移动"],"input_requirements":["画面内清晰单行读数；多数字场景建议使用手动识别范围","固定位置和同一格式的稳定数据流与用户确认","纵向后摄固定机位"],"intent_patterns":["reading.numeric.*"],"model_card":{"model_home_url":"https://github.com/PaddlePaddle/PaddleOCR","model_kind":"specialist","model_name":"PP-OCRv6","provider_id":"paddlepaddle","provider_name":"PaddlePaddle"},"package_ids":["numeric_reader_ppocrv6_medium_v1"],"professional_domain":"固定机位自动数字显示屏读取","recipe_id":"reading_pipeline_general_v1","status":"community"}],"packages":[{"manifest_sha256":"d1152331bdc3d2673a2d9be3490658fc5c76fb7c4fd56c63dac230a2a8113719","manifest_url":"https://models.beyoureye.com/community/2026.09.21.1/manifests/similarity_mediapipe_mobilenet_v3_large_v1.json","package_id":"similarity_mediapipe_mobilenet_v3_large_v1","package_version":"0.3.0-community.1","status":"active"},{"manifest_sha256":"488f51c26d47be3a19c1bb50c2576978cf9b1e62df788f2e121e159fd5bff51e","manifest_url":"https://models.beyoureye.com/community/2026.09.21.1/manifests/numeric_reader_ppocrv6_medium_v1.json","package_id":"numeric_reader_ppocrv6_medium_v1","package_version":"0.3.0-community.1","status":"active"},{"manifest_sha256":"47d9e5fa594663168c4b6fe1e4ef9bfabff19c9a5f48e1293a9c66250c5c463c","manifest_url":"https://models.beyoureye.com/community/2026.09.21.1/manifests/efficientdet_lite2_object_v1.json","package_id":"efficientdet_lite2_object_v1","package_version":"0.3.0-community.1","status":"active"}],"runtime_recipes":[{"candidate_package_ids":["similarity_mediapipe_mobilenet_v3_large_v1"],"capability_id":"visual_target","prompt_modes":["reference_images"],"recipe_id":"neural_reference_target_v1","runtime_family":"similarity_match_v1"},{"candidate_package_ids":["efficientdet_lite2_object_v1"],"capability_id":"visual_target","prompt_modes":["object_class"],"recipe_id":"object_detection_general_v1","runtime_family":"object_detection_v1"},{"candidate_package_ids":["numeric_reader_ppocrv6_medium_v1"],"capability_id":"structured_reading","prompt_modes":["none"],"recipe_id":"reading_pipeline_general_v1","runtime_family":"reading_pipeline_v1"}],"schema_version":"4.0","signature":{"algorithm":"Ed25519","canonicalization":"RFC8785","signing_key_id":"catalog-key-2026-a","value":"hkjDx4HU5a84VFcLAefLsOrxPT1Po2hTaISRVKryTnW3OKmFK7TMgBlQoReu1N+kkDZ/Hq3PzqYuXTnQ9LddAw=="}}
